{
  "schema_version": 1,
  "bundle_id": "signals-public-plain-language-2026-10-05",
  "mode": "agent-assisted",
  "created_at": "2026-10-05T20:08:28Z",
  "producer": {
    "repository": "pradeeptathineni/signals-ai",
    "commit": "4588ec88ed174bfb2874a991d2aeb47bf51fd10d",
    "protocol": "research-protocol-v2"
  },
  "need": {
    "query": "Review purpose, action and limits in the project's own voice. Borrow relevant editorial principles.",
    "concept_ids": [
      "communication.voice",
      "communication.clarity",
      "communication.anti_slop",
      "delivery.documentation"
    ]
  },
  "sources": [
    {
      "id": "clear",
      "uri": "https://guidance.publishing.service.gov.uk/writing-to-gov-uk-standards/writing-guidelines/clear-language/",
      "title": "GOV.UK clear language",
      "source_class": "guidance",
      "observed_at": "2026-10-05T20:00:00Z",
      "revision": null,
      "independence_group": "guidance.publishing.service.gov.uk"
    },
    {
      "id": "tone",
      "uri": "https://guidance.publishing.service.gov.uk/writing-to-gov-uk-standards/writing-guidelines/right-tone/",
      "title": "GOV.UK tone guidance",
      "source_class": "guidance",
      "observed_at": "2026-10-05T20:00:00Z",
      "revision": null,
      "independence_group": "guidance.publishing.service.gov.uk"
    }
  ],
  "claims": [
    {
      "id": "plain-language-clear",
      "text": "GOV.UK directs writers to use familiar plain language, explain necessary specialist terms, and replace vague jargon with specific actions.",
      "source_ids": ["clear"],
      "status": "supported"
    },
    {
      "id": "plain-language-tone",
      "text": "GOV.UK recommends conversational writing, active voice and direct address while preserving precision.",
      "source_ids": ["tone"],
      "status": "supported"
    }
  ],
  "candidates": [
    {
      "id": "option-plain-language",
      "name": "Plain language with precise actions",
      "canonical_uri": "https://guidance.publishing.service.gov.uk/writing-to-gov-uk-standards/writing-guidelines/clear-language/",
      "claim_ids": ["plain-language-clear", "plain-language-tone"],
      "disposition": "consider",
      "reason": "Review purpose, action and limits in the project's own voice. Borrow relevant editorial principles.",
      "limitations": [
        "No local comprehension study was performed. These rules do not detect AI authorship."
      ]
    }
  ],
  "limitations": [
    "Source-backed advice acquired by the host agent. Local benefit and human usefulness have not been established."
  ]
}
