{
  "schema_version": 1,
  "bundle_id": "signals-public-emergency-plan-2026-10-05",
  "mode": "agent-assisted",
  "created_at": "2026-10-05T20:08:28Z",
  "producer": {
    "repository": "pradeeptathineni/signals-ai",
    "commit": "4588ec88ed174bfb2874a991d2aeb47bf51fd10d",
    "protocol": "research-protocol-v2"
  },
  "need": {
    "query": "Prepare a shared contact and meeting plan, keep an accessible paper copy, and check it with household members."
  },
  "sources": [
    {
      "id": "texas",
      "uri": "https://texasready.gov/make-a-plan/how-to-make-a-plan.html",
      "title": "Texas DSHS emergency planning",
      "source_class": "guidance",
      "observed_at": "2026-10-05T20:00:00Z",
      "revision": null,
      "independence_group": "texasready.gov"
    }
  ],
  "claims": [
    {
      "id": "emergency-plan-texas",
      "text": "Texas DSHS recommends a written shared plan with local and out-of-town contacts and meeting places; it offers a printable form and notes that messaging may work during phone disruption.",
      "source_ids": ["texas"],
      "status": "supported"
    }
  ],
  "candidates": [
    {
      "id": "option-emergency-plan",
      "name": "Make a household communication plan",
      "canonical_uri": "https://texasready.gov/make-a-plan/how-to-make-a-plan.html",
      "claim_ids": ["emergency-plan-texas"],
      "disposition": "consider",
      "reason": "Prepare a shared contact and meeting plan, keep an accessible paper copy, and check it with household members.",
      "limitations": [
        "Communication planning only. Local hazard and evacuation directions require jurisdiction-specific guidance.",
        "No household practice outcome was observed. Ready.gov retrieval was unavailable during acquisition."
      ]
    }
  ],
  "limitations": [
    "Source-backed advice acquired by the host agent. Local benefit and human usefulness have not been established."
  ]
}
