{
  "schema_version": 1,
  "bundle_id": "study-context-22183f4",
  "mode": "agent-assisted",
  "created_at": "2026-10-05T16:44:13.947Z",
  "producer": {
    "repository": "pradeeptathineni/signals-ai",
    "commit": "22183f4875c8838b33670afa1866e104b971adbc",
    "protocol": "signals-evidence-v1"
  },
  "need": {
    "query": "Equip a coding agent with small portable repository instructions and on-demand procedures while preserving authority and progressive disclosure.",
    "concept_ids": [
      "study-context"
    ]
  },
  "sources": [
    {
      "id": "skills",
      "uri": "https://agentskills.io/specification",
      "title": "Agent Skills specification",
      "source_class": "first-party",
      "observed_at": "2026-10-05T15:47:15Z",
      "revision": null,
      "independence_group": "agentskills-spec"
    },
    {
      "id": "agents",
      "uri": "https://learn.chatgpt.com/docs/agent-configuration/agents-md",
      "title": "Codex repository instructions",
      "source_class": "first-party",
      "observed_at": "2026-10-05T15:47:15Z",
      "revision": null,
      "independence_group": "openai-docs"
    }
  ],
  "claims": [
    {
      "id": "claim-skills",
      "text": "Agent Skills packages on-demand instructions and supporting references in a skill directory.",
      "source_ids": [
        "skills"
      ],
      "status": "supported"
    },
    {
      "id": "claim-agents",
      "text": "Codex repository instructions have scoped discovery and precedence rules.",
      "source_ids": [
        "agents"
      ],
      "status": "supported"
    }
  ],
  "candidates": [
    {
      "id": "skills",
      "name": "Agent Skills specification",
      "canonical_uri": "https://agentskills.io/specification",
      "claim_ids": [
        "claim-skills"
      ],
      "disposition": "consider",
      "reason": "Use this attributed reference for the part of the need it directly supports.",
      "limitations": [
        "Actual native discovery/activation remains provider-specific."
      ],
      "signal": {
        "evidence_confidence": "medium",
        "project_fit": "unknown"
      }
    },
    {
      "id": "agents",
      "name": "Codex repository instructions",
      "canonical_uri": "https://learn.chatgpt.com/docs/agent-configuration/agents-md",
      "claim_ids": [
        "claim-agents"
      ],
      "disposition": "consider",
      "reason": "Use this attributed reference for the part of the need it directly supports.",
      "limitations": [
        "Actual native discovery/activation remains provider-specific."
      ],
      "signal": {
        "evidence_confidence": "medium",
        "project_fit": "unknown"
      }
    }
  ],
  "limitations": [
    "Actual native discovery/activation remains provider-specific.",
    "Builder-assisted, small selected set; no configured application-model call or independent evaluation."
  ],
  "extensions": {
    "signals.study": {
      "implementation_frozen": true,
      "claims_are": "Primary-source summaries; candidate usefulness is builder judgment."
    }
  }
}
