{
  "schema_version": 1,
  "bundle_id": "signals-public-test-isolation-2026-10-05",
  "mode": "agent-assisted",
  "created_at": "2026-10-05T20:08:28Z",
  "producer": {
    "repository": "pradeeptathineni/signals-ai",
    "commit": "4588ec88ed174bfb2874a991d2aeb47bf51fd10d",
    "protocol": "research-protocol-v2"
  },
  "need": {
    "query": "Keep the existing isolated test lifecycle when sufficient. Trial Testcontainers only if it replaces lifecycle maintenance.",
    "concept_ids": [
      "quality.integration_tests",
      "quality.reproducibility",
      "agents.isolation",
      "data.persistence"
    ]
  },
  "sources": [
    {
      "id": "containers",
      "uri": "https://node.testcontainers.org/features/containers/",
      "title": "Testcontainers for Node: containers",
      "source_class": "documentation",
      "observed_at": "2026-10-05T20:00:00Z",
      "revision": null,
      "independence_group": "node.testcontainers.org"
    }
  ],
  "claims": [
    {
      "id": "test-isolation-containers",
      "text": "Testcontainers documents stop and removal controls, including container-created volumes; reuse and cleanup settings can retain state.",
      "source_ids": ["containers"],
      "status": "supported"
    }
  ],
  "candidates": [
    {
      "id": "option-test-isolation",
      "name": "Owned disposable dependency tests",
      "canonical_uri": "https://node.testcontainers.org/features/containers/",
      "claim_ids": ["test-isolation-containers"],
      "disposition": "consider",
      "reason": "Keep the existing isolated test lifecycle when sufficient. Trial Testcontainers only if it replaces lifecycle maintenance.",
      "limitations": [
        "No library was installed or exercised. Cleanup controls do not prove isolation from retained databases, bind mounts or external effects."
      ]
    }
  ],
  "limitations": [
    "Source-backed advice acquired by the host agent. Local benefit and human usefulness have not been established."
  ]
}
