{
  "schema_version": 1,
  "bundle_id": "study-family-photos-22183f4",
  "mode": "agent-assisted",
  "created_at": "2026-10-05T16:44:14.905Z",
  "producer": {
    "repository": "pradeeptathineni/signals-ai",
    "commit": "22183f4875c8838b33670afa1866e104b971adbc",
    "protocol": "signals-evidence-v1"
  },
  "need": {
    "query": "Store and handle family printed photographs on a modest budget using practical official guidance; retain unknown material or damage risks.",
    "concept_ids": [
      "study-family-photos"
    ]
  },
  "sources": [
    {
      "id": "loc",
      "uri": "https://www.loc.gov/preservation/care/photo.html",
      "title": "Library of Congress photograph care",
      "source_class": "primary-guidance",
      "observed_at": "2026-10-05T16:44:12.646Z",
      "revision": null,
      "independence_group": "library-of-congress"
    },
    {
      "id": "nara",
      "uri": "https://www.archives.gov/publications/prologue/2015/fall/handling-photos.html",
      "title": "National Archives family photographs",
      "source_class": "primary-guidance",
      "observed_at": "2026-10-05T16:44:12.646Z",
      "revision": "2015-fall",
      "independence_group": "national-archives"
    }
  ],
  "claims": [
    {
      "id": "claim-loc",
      "text": "Library of Congress guidance favors careful edge handling, stable storage and photo-safe enclosures.",
      "source_ids": [
        "loc"
      ],
      "status": "supported"
    },
    {
      "id": "claim-nara",
      "text": "National Archives recommends gentle supported handling and avoiding adhesives; stop when handling causes damage.",
      "source_ids": [
        "nara"
      ],
      "status": "supported"
    }
  ],
  "candidates": [
    {
      "id": "loc",
      "name": "Library of Congress photograph care",
      "canonical_uri": "https://www.loc.gov/preservation/care/photo.html",
      "claim_ids": [
        "claim-loc"
      ],
      "disposition": "consider",
      "reason": "Use this attributed reference for the part of the need it directly supports.",
      "limitations": [
        "Photo processes and condition unknown; no restoration treatment or supplier-price comparison.",
        "Glove guidance differs in detail: LOC discusses clean hands/nitrile and dexterity; NARA advises cotton/nitrile."
      ],
      "signal": {
        "evidence_confidence": "medium",
        "project_fit": "unknown"
      }
    },
    {
      "id": "nara",
      "name": "National Archives family photographs",
      "canonical_uri": "https://www.archives.gov/publications/prologue/2015/fall/handling-photos.html",
      "claim_ids": [
        "claim-nara"
      ],
      "disposition": "consider",
      "reason": "Use this attributed reference for the part of the need it directly supports.",
      "limitations": [
        "Photo processes and condition unknown; no restoration treatment or supplier-price comparison.",
        "Glove guidance differs in detail: LOC discusses clean hands/nitrile and dexterity; NARA advises cotton/nitrile."
      ],
      "signal": {
        "evidence_confidence": "medium",
        "project_fit": "unknown"
      }
    }
  ],
  "limitations": [
    "Photo processes and condition unknown; no restoration treatment or supplier-price comparison.",
    "Glove guidance differs in detail: LOC discusses clean hands/nitrile and dexterity; NARA advises cotton/nitrile.",
    "Builder-assisted, small selected set; no configured application-model call or independent evaluation."
  ],
  "extensions": {
    "signals.study": {
      "implementation_frozen": true,
      "claims_are": "Primary-source summaries; candidate usefulness is builder judgment."
    }
  }
}
