{
  "schema_version": 1,
  "bundle_id": "signals-public-review-understanding-2026-10-05",
  "mode": "agent-assisted",
  "created_at": "2026-10-05T20:08:28Z",
  "producer": {
    "repository": "pradeeptathineni/signals-ai",
    "commit": "4588ec88ed174bfb2874a991d2aeb47bf51fd10d",
    "protocol": "research-protocol-v2"
  },
  "need": {
    "query": "Give the reviewer the trigger, intended behavior, constraints and reachable evidence. Ask for actionable findings about consequences.",
    "concept_ids": ["quality.review", "communication.clarity", "agents.handoff"]
  },
  "sources": [
    {
      "id": "review-study",
      "uri": "https://www.microsoft.com/en-us/research/publication/expectations-outcomes-and-challenges-of-modern-code-review/",
      "title": "Expectations, Outcomes, and Challenges of Modern Code Review",
      "source_class": "research",
      "observed_at": "2026-10-05T20:00:00Z",
      "revision": "ICSE 2013",
      "independence_group": "www.microsoft.com"
    }
  ],
  "claims": [
    {
      "id": "review-understanding-review-study",
      "text": "The Microsoft study found change understanding central to modern code review; knowledge transfer, team awareness and alternative solutions were also observed outcomes.",
      "source_ids": ["review-study"],
      "status": "supported"
    }
  ],
  "candidates": [
    {
      "id": "option-review-understanding",
      "name": "Review the change and its consequences",
      "canonical_uri": "https://www.microsoft.com/en-us/research/publication/expectations-outcomes-and-challenges-of-modern-code-review/",
      "claim_ids": ["review-understanding-review-study"],
      "disposition": "consider",
      "reason": "Give the reviewer the trigger, intended behavior, constraints and reachable evidence. Ask for actionable findings about consequences.",
      "limitations": [
        "Older human organizational research does not prove that AI review or additional reviewers improves this repository."
      ]
    }
  ],
  "limitations": [
    "Source-backed advice acquired by the host agent. Local benefit and human usefulness have not been established."
  ]
}
