{
  "schema_version": 1,
  "bundle_id": "study-web-design-22183f4",
  "mode": "agent-assisted",
  "created_at": "2026-10-05T16:44:13.037Z",
  "producer": {
    "repository": "pradeeptathineni/signals-ai",
    "commit": "22183f4875c8838b33670afa1866e104b971adbc",
    "protocol": "signals-evidence-v1"
  },
  "need": {
    "query": "Build a coherent React/Vite research UI that makes source clarity, uncertainty, accessible mobile reading and browser critique practical.",
    "concept_ids": [
      "study-web-design"
    ]
  },
  "sources": [
    {
      "id": "impeccable",
      "uri": "https://github.com/pbakaus/impeccable",
      "title": "Impeccable design workflow",
      "source_class": "first-party",
      "observed_at": "2026-10-05T15:47:15Z",
      "revision": "ece38d9904b8a619b3f77cab476eacad09c4fb11",
      "independence_group": "impeccable-upstream"
    },
    {
      "id": "react",
      "uri": "https://github.com/vercel-labs/agent-skills",
      "title": "Vercel React guidance",
      "source_class": "first-party",
      "observed_at": "2026-10-05T15:47:15Z",
      "revision": "063bee94c3f4df8453406c830b0a7df0f2860278",
      "independence_group": "vercel-upstream"
    },
    {
      "id": "react-lazy",
      "uri": "https://react.dev/reference/react/lazy",
      "title": "React lazy",
      "source_class": "primary-guidance",
      "observed_at": "2026-10-05T16:44:12.646Z",
      "revision": "19.3",
      "independence_group": "react-docs"
    }
  ],
  "claims": [
    {
      "id": "claim-impeccable",
      "text": "Impeccable distributes instructions for design and critique of an existing product.",
      "source_ids": [
        "impeccable"
      ],
      "status": "supported"
    },
    {
      "id": "claim-react",
      "text": "The React skill offers implementation guidance whose framework-specific examples require stack review.",
      "source_ids": [
        "react"
      ],
      "status": "supported"
    },
    {
      "id": "claim-react-lazy",
      "text": "React lazy defers a component until first render and works with Suspense.",
      "source_ids": [
        "react-lazy"
      ],
      "status": "supported"
    }
  ],
  "candidates": [
    {
      "id": "impeccable",
      "name": "Impeccable design workflow",
      "canonical_uri": "https://github.com/pbakaus/impeccable",
      "claim_ids": [
        "claim-impeccable"
      ],
      "disposition": "consider",
      "reason": "Use this attributed reference for the part of the need it directly supports.",
      "limitations": [
        "No controlled comparison of design methods.",
        "Next/dynamic is a Next.js example; React/Vite uses its own lazy import."
      ],
      "signal": {
        "evidence_confidence": "medium",
        "project_fit": "unknown"
      }
    },
    {
      "id": "react",
      "name": "Vercel React guidance",
      "canonical_uri": "https://github.com/vercel-labs/agent-skills",
      "claim_ids": [
        "claim-react"
      ],
      "disposition": "consider",
      "reason": "Use this attributed reference for the part of the need it directly supports.",
      "limitations": [
        "No controlled comparison of design methods.",
        "Next/dynamic is a Next.js example; React/Vite uses its own lazy import."
      ],
      "signal": {
        "evidence_confidence": "medium",
        "project_fit": "unknown"
      }
    },
    {
      "id": "react-lazy",
      "name": "React lazy",
      "canonical_uri": "https://react.dev/reference/react/lazy",
      "claim_ids": [
        "claim-react-lazy"
      ],
      "disposition": "consider",
      "reason": "Use this attributed reference for the part of the need it directly supports.",
      "limitations": [
        "No controlled comparison of design methods.",
        "Next/dynamic is a Next.js example; React/Vite uses its own lazy import."
      ],
      "signal": {
        "evidence_confidence": "medium",
        "project_fit": "unknown"
      }
    }
  ],
  "limitations": [
    "No controlled comparison of design methods.",
    "Next/dynamic is a Next.js example; React/Vite uses its own lazy import.",
    "Builder-assisted, small selected set; no configured application-model call or independent evaluation."
  ],
  "extensions": {
    "signals.study": {
      "implementation_frozen": true,
      "claims_are": "Primary-source summaries; candidate usefulness is builder judgment."
    }
  }
}
