{
  "schema_version": 1,
  "bundle_id": "signals-public-source-lineage-2026-10-05",
  "mode": "agent-assisted",
  "created_at": "2026-10-05T20:08:28Z",
  "producer": {
    "repository": "pradeeptathineni/signals-ai",
    "commit": "4588ec88ed174bfb2874a991d2aeb47bf51fd10d",
    "protocol": "research-protocol-v2"
  },
  "need": {
    "query": "Keep source identity and attribution on each claim. Reuse the existing records before adopting a separate provenance framework.",
    "concept_ids": [
      "research.provenance",
      "context.provenance",
      "data.lineage",
      "delivery.artifacts"
    ]
  },
  "sources": [
    {
      "id": "prov",
      "uri": "https://www.w3.org/TR/2013/REC-prov-dm-20130430/",
      "title": "W3C PROV-DM",
      "source_class": "standard",
      "observed_at": "2026-10-05T20:00:00Z",
      "revision": "2013-04-30 Recommendation",
      "independence_group": "www.w3.org"
    }
  ],
  "claims": [
    {
      "id": "source-lineage-prov",
      "text": "PROV-DM models entities, activities, agents, derivation and attribution. Provenance descriptions can themselves have provenance.",
      "source_ids": ["prov"],
      "status": "supported"
    }
  ],
  "candidates": [
    {
      "id": "option-source-lineage",
      "name": "Source-bound claims and derivation",
      "canonical_uri": "https://www.w3.org/TR/2013/REC-prov-dm-20130430/",
      "claim_ids": ["source-lineage-prov"],
      "disposition": "consider",
      "reason": "Keep source identity and attribution on each claim. Reuse the existing records before adopting a separate provenance framework.",
      "limitations": [
        "Lineage helps assess a claim; it does not prove truth, originality or independent corroboration."
      ]
    }
  ],
  "limitations": [
    "Source-backed advice acquired by the host agent. Local benefit and human usefulness have not been established."
  ]
}
